story_id,title,story,moral,emotion,theme
1,Monkey and Crocodile,"Deep within the heart of an ancient forest, there lived a clever monkey who'd made his home atop a sprawling mango tree beside a wide, glittering river. The tree's branches, heavy with ripe fruit, hung low over the water's edge — and it was here that the monkey first befriended a large crocodile who swam nearby each morning. ""You're most welcome to share my fruits,"" the monkey offered generously, tossing mangoes into the water with a grin. Days turned to weeks, and the two became inseparable companions. However, the crocodile's wife, suspicious of her husband's long absences, demanded an explanation. Upon hearing of the sweet fruits, she grew cunning and greedy. ""If those mangoes are so delicious,"" she whispered, ""imagine how sweet the heart of a monkey who eats them daily must be!"" The crocodile, torn between love and loyalty, reluctantly agreed to bring his friend's heart to her. He invited the monkey for a ride across the river — but halfway through, confessed the dreadful plan. The monkey's pulse quickened, yet his mind stayed razor-sharp. ""Oh dear!"" he exclaimed with a theatrical gasp. ""I've left my heart back on the tree — I always keep it there for safekeeping!"" The foolish crocodile turned back immediately. The moment they reached the bank, the monkey leapt to safety with a triumphant laugh. He never crossed that river again, nor did he ever place blind trust in flattering strangers.",Never trust blindly; true friendship isn't built on deceit.,betrayal,trust
2,Lion and Rabbit,"In a lush jungle that had once rung with laughter and birdsong, a fearsome lion had reduced every creature to trembling silence. Each day without fail, he'd demand a fresh animal be sent to him as his meal — and the terrified inhabitants had no choice but to comply. Eventually, only a small, sharp-witted rabbit remained unafraid. ""I'll go myself,"" he announced calmly, ""but I'll go on my own terms."" He arrived before the lion deliberately late, his ears perked confidently. ""Explain yourself!"" the lion roared, his mane bristling. ""Your Majesty,"" the rabbit said with a low bow, ""I was waylaid by another lion — a far bigger one — who claims this jungle belongs to him!"" The lion's eyes blazed. ""Show me this imposter at once!"" The rabbit led him to a deep, still well at the forest's edge. ""He lives down there, Your Majesty,"" he said softly. The lion peered in, saw his own furious reflection staring back, and with a thunderous roar, leapt headlong into the well. The splash echoed through the jungle — and was followed by the sweetest silence the animals had ever heard. The rabbit returned to a forest reborn in joy.",Intelligence and presence of mind can overcome even the greatest brute strength.,fear,intelligence
3,Fox and Crow,"High up in the gnarled branches of an old oak tree, a glossy black crow perched proudly with a prized piece of golden cheese clutched firmly in her beak. Below, a red fox trotted past and halted — his sharp nose twitching at the delicious scent drifting down. He studied the crow for a long, calculating moment before clearing his throat with exaggerated admiration. ""My goodness,"" the fox exclaimed, placing a paw over his heart, ""I've travelled these forests for years and never encountered a bird of such breathtaking elegance! Those feathers — jet-black and luminous as the night sky! And that regal posture! I'd wager that a creature of such magnificence must surely possess a voice equally divine."" The crow's chest swelled with vanity. She'd always suspected she was rather exceptional, and here was confirmation at last! Desperate to demonstrate her magnificent voice, she opened her beak wide — and the cheese plummeted straight into the fox's waiting jaws. ""Thank you kindly,"" the fox called up cheerfully as he trotted away. ""A beautiful voice, indeed — though perhaps wisdom is worth more than vanity."" The crow sat in mortified silence, the bitter lesson settling in her chest far heavier than any cheese.",Beware of flattery; it is often the weapon of those who wish to deceive you.,deception,greed
4,Tortoise and Birds,"There was once a tortoise — slow of foot but rich in longing — who watched with aching envy as the birds of the forest swooped and soared through the endless blue sky each morning. ""If only I could fly,"" he would sigh, his ancient eyes following their effortless arcs. Two kind-hearted cranes, moved by his yearning, devised a plan. They brought a sturdy stick and instructed the tortoise carefully: ""Bite down on the centre of this stick. We'll each hold one end and carry you through the sky — but whatever you do, do NOT open your mouth, no matter what you hear below."" The tortoise agreed solemnly. Up, up, up they rose — and the tortoise found himself breathless with wonder, the forest canopy spreading like a green tapestry beneath him. Then, from a village below, children pointed and shouted in amazement: ""Look! A flying tortoise! How ridiculous!"" The tortoise's pride flared hot and instant. ""Ridiculous?!"" he wanted to snap back furiously — and the moment he parted his lips to retort, he plunged. He struck the earth with a devastating thud. The cranes circled mournfully overhead. A single, irreversible moment of ego had cost him everything.",Overconfidence and pride can undo even the most extraordinary opportunities.,fear,overconfidence
5,Blue Jackal,"It was a moonless, chaotic night when a scraggly jackal, fleeing from a pack of fierce village dogs, stumbled blindly into a washerman's courtyard and tumbled headlong into a vast vat of indigo-blue dye. He scrambled out dripping and gasping — and when dawn broke and the forest animals caught sight of him, pandemonium erupted. No one had ever seen a creature of such extraordinary colour. ""He must be a messenger of the gods!"" someone whispered. The jackal, always quick on his paws, immediately seized the moment. ""Indeed,"" he announced grandly. ""I am Kakudruma, sent by the Creator himself to reign over this forest!"" The animals bowed in awe, and the jackal revelled in his stolen glory — feasting first, ruling absolutely, growing fat on deception. He banished all fellow jackals, fearing they'd recognise him. But one fateful evening, a distant pack raised their haunting, unmistakable howl into the night air. Something ancient and uncontrollable stirred in the blue jackal's chest — and before he could stop himself, he threw back his head and howled in reply. The colour meant nothing now. His voice had betrayed everything. The animals turned on him in furious disbelief, and the self-proclaimed king fled into the darkness, stripped of every false crown.","A false identity, however convincing, cannot be sustained forever — truth will always surface.",surprise,identity
6,Elephant and Mice,"Long ago, when a great herd of elephants migrated through the ruins of an abandoned city in search of water, they trampled unknowingly through a sprawling colony of mice, crushing homes and families beneath their enormous feet. The chief of the mice, trembling but resolute, approached the elephant king and bowed humbly. ""Your Majesty,"" he said, his voice barely a squeak above the wind, ""we are small — far too small, perhaps, to be noticed. But I beg you, please choose another path. And should you ever need us, no matter how unlikely that seems, we will repay your kindness."" The elephant king chuckled at the thought — what could mice possibly do for him? But he was a generous soul and agreed to reroute the herd. Months later, hunters swept through the forest, capturing the entire elephant herd in vast nets of rope, staking them to the ground. Their trumpeting cries of despair echoed through the night. And it was then that the mice came — thousands of them, gnawing tirelessly through the thick ropes with their sharp teeth until, one by one, the elephants stumbled free into the open air. The elephant king looked down at his tiny saviours with tears in his wise old eyes. ""Never again,"" he vowed quietly, ""will I underestimate what kindness returns to you.""",No act of kindness is ever too small; even the mightiest may one day need the humblest.,friendship,cooperation
7,Two Goats on the Bridge,"Spanning a narrow, rushing mountain stream was a single-plank bridge — barely wide enough for one creature to cross at a time. It was upon this precarious crossing that two goats, approaching from opposite banks, met face-to-face in the middle. Neither was willing to step aside. ""I was here first,"" insisted the first goat, stamping his hoof. ""Nonsense — I have equal right to this bridge!"" the second retorted, lowering his horns. Travellers who'd gathered on both banks watched with growing alarm as the goats pressed closer, each refusing to yield even a single inch. Their breathing grew heavy, their eyes wild with stubborn fury. Words gave way to shoving — then to a violent clash of horns — and within moments, both goats lost their footing on the narrow plank and tumbled together into the cold, churning water below. Neither survived. The watching animals stood in mournful silence. The bridge remained — empty, passable, patient. One small concession from either goat would have cost nothing and saved everything. But ego, given no outlet, had demanded the highest possible price.",Stubbornness and pride serve no one; learning to yield gracefully is far greater than winning nothing.,anger,ego
8,Farmer and the Snake,"On a bitter winter's morning, a kind-hearted farmer discovered a serpent lying motionless and stiff in the snow — frozen, as far as he could tell, nearly to death. Moved by compassion despite his wife's sharp warnings, he scooped the snake up gently and tucked it inside his warm coat, pressed close against his chest. Gradually, the creature's cold scales began to warm. Its body slowly stirred back to life. But the moment the snake felt strength return to its muscles, it recoiled and struck — driving its fangs toward the farmer's arm. The farmer leapt back just in time, flinging the snake to the ground in shock. ""I saved your life!"" he cried, his voice cracking. The snake regarded him with cold, unblinking eyes. ""Your sentiment is your concern,"" it hissed. ""My nature is my own."" The farmer stood there in the snow for a long time after the snake had vanished into the undergrowth. He was not a bitter man — but he understood now, with crystalline clarity, that gratitude cannot be assumed, and that the nature of some things cannot be altered by an act of warmth, however sincerely given.",Kindness is noble — but wisdom demands you understand the nature of those you help.,fear,trust
9,Lion and the Mouse,"The great lion lay sleeping beneath the shade of an acacia tree, his golden flanks rising and falling with slow, deep breaths, when a tiny mouse — scurrying in careless excitement — ran directly across his nose. The lion's eyes flew open. His massive paw came down, pinning the mouse to the ground with effortless ease. ""Any last words before I eat you?"" the lion rumbled, more amused than hungry. The mouse's heart hammered wildly, but she kept her voice steady. ""Your Majesty, I beg your mercy — and I swear on my life that one day, however improbable it seems, I shall repay this kindness!"" The lion burst into laughter at the absurdity of it, but released her nonetheless. ""Run along, little one,"" he said warmly. Weeks later, hunters ensnared the lion in a thick rope net, and his desperate roars shook the trees. The little mouse heard him from across the forest. She arrived without hesitation, set her sharp teeth to the ropes, and gnawed with fierce determination until the lion pulled himself free. He lay on the grass, breathing hard, and looked at her with an expression she'd never seen on the face of anything so powerful — gratitude, pure and unguarded.",Even the smallest among us carries the capacity for tremendous impact; never dismiss a kindness offered.,friendship,gratitude
10,Merchant and the Thief,"A prosperous merchant, returning from a successful trading journey, stopped at a roadside inn one dusty evening and struck up easy conversation with a well-dressed, charming stranger at the next table. The stranger spoke eloquently of distant cities, shared stories that made the merchant roar with laughter, and expressed such warm, genuine interest that the merchant felt he'd made a true friend within an hour. When the stranger offered to watch over the merchant's cart of goods while he slept — after all, the inn was crowded and the merchant was exhausted — he accepted gratefully without a second thought. By the time the pale grey light of dawn crept through the window, the stranger had vanished completely. So had every piece of goods in the cart. The merchant sat amid the empty cart in disbelief, running through every warming smile, every reassuring word. He had given his trust instinctively, without scrutiny — and now there was nothing left but the hollow echo of a lesson that cost him dearly. He rebuilt, eventually. But he never again let a pleasant manner substitute for the slow, careful work of genuinely knowing someone.",Trust must be earned gradually; charm and warmth are not substitutes for proven character.,betrayal,trust
11,The Loyal Dog,"For as long as anyone in the village could remember, the merchant's old dog had kept faithful watch over the household — sleeping lightly, one ear always raised, throughout even the coldest nights. When a band of thieves crept silently through the shadows one moonless evening, tools in hand and voices hushed, it was the dog who heard them first. His bark split the silence like a thunderclap — loud, relentless, and entirely fearless despite the size of the intruders. The thieves scattered in panic before a single latch had been lifted. Lights came on throughout the house; voices called out in alarm; the neighbourhood stirred. By morning, nothing had been taken. The merchant knelt beside the old dog with a full heart, stroking his greying muzzle. Around the village, people spoke of the night with admiration. Some had loyal dogs, some had stone walls, some had locked gates — but what had saved this household was something that couldn't be purchased or constructed: an unwavering devotion that asked nothing in return and gave everything without hesitation.","Loyalty, freely and faithfully given, is among the most powerful protections one can possess.",joy,trust
12,Wise Old Bird,"In a forest of tall, ancient trees, an old bird with thinning feathers and knowing eyes watched with quiet unease as a man moved slowly through the undergrowth below — studying the trees, testing the soil, measuring distances with calculated eyes. The old bird called the flock together with urgent alarm. ""He's a hunter,"" she said gravely. ""I've seen this before. Leave this forest now, while there's still time."" But the younger birds ruffled their bright feathers dismissively. ""You're too cautious,"" they laughed. ""That old man is no threat — he's barely moving! We'll stay and keep watch ourselves."" The old bird shook her head sadly and departed alone that evening. Within three days, the hunter returned with nets, traps, and two assistants. The younger birds, startled and unprepared, found themselves snared before they could take to the sky. As they struggled in the nets, they remembered the old bird's words — calm, unhurried, certain. Experience, they understood too late, speaks in a quieter voice than excitement; but it speaks with a precision that youth, in its confidence, so often fails to hear.",Wisdom earned through experience is precious; dismiss the counsel of elders at your own peril.,fear,wisdom
13,Camel and the Jackal,"A camel and a jackal struck up an unlikely friendship near a river that separated their home territory from a field of ripe sugarcane on the opposite bank. ""I'll carry you across on my back,"" the camel offered warmly, ""and we'll share whatever we find."" The jackal, whose stomach was considerably smaller, ate his fill quickly while the camel was still grazing contentedly. Then, seized by an impulse he didn't bother to resist, the jackal threw back his head and began howling loudly into the air. The farmers came running with sticks. The camel, enormous and impossible to miss, received the full force of their anger while the jackal slipped away through the grass. When they finally recrossed the river — the camel limping, bruised, and bewildered — he asked the jackal why he'd howled. ""It's simply something I do after a meal,"" the jackal replied breezily. ""I can't help my nature."" The camel said nothing. But in the middle of the river, at its deepest point, he slowly rolled onto his side. ""I sometimes roll after eating,"" he said pleasantly, as the jackal plunged beneath the surface with a shriek. What is given carelessly is repaid in kind.","Those who exploit generosity will, in time, reap what they have sown.",betrayal,trust
14,Foolish Lion,"There was once a lion — immense in body but unfortunately modest in intellect — who ruled his jungle with thunderous authority. When a clever rabbit approached him one afternoon with a look of theatrical breathlessness, the lion's ears pricked up immediately. ""Your Majesty,"" the rabbit gasped, ""there is another lion — larger, fiercer, and louder than yourself — who has entered the forest and declared himself its true king!"" The lion's entire frame trembled with volcanic outrage. ""Take me to him NOW!"" he thundered. The rabbit led him to a deep stone well at the edge of the trees. ""He dwells below, Your Majesty — look!"" The lion thrust his great head over the edge and peered down. In the dark water below, a furious lion stared back at him — mane bristling, eyes blazing, matching his every expression perfectly. The lion roared with everything he had. The reflection roared back, soundless and maddening. Consumed by blind fury and utterly convinced, the lion launched himself over the edge. The splash that followed was immense, and final. The rabbit walked back through the jungle at a leisurely pace, the forest already breathing easier around him.",Blind rage and unchecked ego are weaknesses a clever adversary will always find a way to exploit.,fear,intelligence
15,Elephant and Rabbit,"When a herd of elephants began passing through a rabbit colony's meadow each night on their way to the lake, the rabbits found themselves in a desperate situation — burrows collapsed, families scattered, and the survivors left shaking in the darkness. The smallest and most quick-witted rabbit in the colony stood before the others with an unexpected air of calm. ""I'll handle this,"" she said. She approached the lead elephant in the silver light of the full moon, sitting upright in the grass with an expression of absolute serenity. ""Great one,"" she announced, ""I am a messenger of the Moon itself, whose sacred reflection you have disturbed by trampling the lake's shores. The Moon is displeased. If you wish to make amends, look into the water tonight and see for yourself."" The elephant, humbled and genuinely unsettled, peered into the rippling lake. The moon's reflection shimmered and wavered — trembling, it seemed, with celestial disapproval. The elephant stepped back respectfully, turned the herd around, and never returned. The rabbits celebrated until dawn. A single story, precisely placed, had accomplished what no amount of force ever could have.","Creativity and quick thinking are often more powerful than size, speed, or physical strength.",triumph,intelligence
16,Crow's Revenge on the Snake,"Season after season, a great black crow and his mate had nested in the hollow of an old banyan tree, raising their young with patient devotion. And season after season, a cunning cobra who lived in the roots of that same tree had stolen into their nest in their absence and swallowed their eggs whole — leaving them to return to an empty home and unimaginable grief. The crow's mate wept until she could weep no more. But the crow himself grew quiet and deliberate. He flew to the palace grounds one afternoon, watching the noblewomen walking in the garden below — their jewels catching the afternoon light. With careful precision, he swooped, snatched a glittering necklace from around a princess's neck, and dropped it directly into the cobra's hole at the base of the tree. The commotion that followed was immediate and decisive: servants poured into the garden, traced the necklace to the hole, and dealt with the cobra then and there. The crow returned to his tree in the evening light. He had lost many clutches of eggs — but he had never lost his capacity to think clearly, and that, in the end, had settled the matter completely.","Patient, strategic thinking can resolve what years of grief and direct confrontation cannot.",anger,revenge
17,Monkey and the Wedge,"At the edge of a great construction site, where carpenters were building a temple from freshly cut timber, a young monkey perched in the trees and watched the workers with burning, restless curiosity. When the men broke for their midday meal and left the site unattended, the monkey descended immediately. He bounded from plank to plank, testing tools, scattering sawdust — thrilling in the freedom of the space. Then he noticed a large log that had been partially split, a thick wooden wedge hammered into the crack to hold it open. The wedge, slightly loose, wobbled when he touched it. The monkey's curiosity became irresistible. He wrapped both hands around the wedge and pulled — hard. The wedge came free with a sharp crack, and the split log snapped shut instantly, catching both of the monkey's legs between its jaws with crushing force. He screamed. The workers came running. It took four men and considerable effort to prise the log open again. The monkey limped back to the forest in silence, carrying a lesson he had paid for entirely with his own recklessness. Curiosity, he understood now, without caution, is simply another word for danger.",Curiosity without restraint or awareness can lead even the cleverest creature into serious harm.,fear,curiosity
18,The Golden Deer,"Deep within a protected forest, there moved a deer of extraordinary beauty — her coat the warm gold of late afternoon light, her eyes dark and luminous, her movements so fluid she seemed to barely touch the ground. Word of this creature reached a king known for his obsessive love of hunting, and he arrived at the forest's edge with his full retinue of soldiers, his fastest horses, and his finest bows. The golden deer watched them come from the tree line. She turned and ran — but not away from them. She ran in widening, purposeful circles, drawing the hunters deeper and deeper into the thickest, most impenetrable parts of the forest, away from where the other animals grazed and sheltered. Thorns caught at the soldiers' clothes. Horses stumbled on uneven ground. The king pressed on for hours, growing increasingly lost, until at last he drew up his horse and admitted defeat. The deer, her task complete, stood briefly on a hillside above them — caught the last golden light of the sun — and vanished. Not a single arrow had found her. Not a single other animal had been touched. She had offered herself as bait and emerged untouched. The forest, by morning, was quiet and whole.",True courage is not recklessness — it is the willingness to place yourself in danger for the protection of others.,surprise,sacrifice
19,Heron and the Crab,"An old heron who had grown too slow and lazy to hunt properly concocted a scheme so brazen it might have been admirable, had it not been so wicked. He approached the pond where fish and crabs lived peaceably and arranged his face into an expression of deep sorrow. ""I bring terrible news,"" he announced with a doleful shake of his long neck. ""I've overheard fishermen planning to drain this pond entirely. But I'm willing — out of the goodness of my heart — to carry you all, one by one, to a much deeper and safer lake nearby."" The fish believed him utterly. One by one they were carried — and one by one they vanished. It was a sharp-clawed crab who first noticed that the heron always returned alone. ""I'd like to see this lake myself,"" the crab said pleasantly, and climbed onto the heron's neck for the journey. When the heron landed at his private feeding rock — surrounded by a small mountain of fish bones — the crab understood everything in an instant. Before the heron could so much as open his beak, the crab's claws had closed around his neck with the precision of a trap. The pond, some days later, was significantly quieter — but its remaining inhabitants lived without fear.","Deception practiced against the vulnerable will, with patience, always find its just reckoning.",anger,betrayal
