story_id,title,story,moral,emotion,theme
20,Fox and Goat in the Well,"A fox, careless in his hurry, tumbled into a wide stone well one bright afternoon and found himself unable to scramble back up the smooth walls no matter how he tried. He splashed about for a while, then gathered himself and settled into a patient crouch, thinking. When a goat trotted to the well's edge and peered down with concerned eyes, the fox arranged his expression into one of pure contentment. ""My friend!"" he called up warmly. ""You must come down and try this water — it's the sweetest, coldest, most extraordinary water I've ever tasted. I've been drinking it all morning; I simply cannot bring myself to leave!"" The goat, who was genuinely thirsty, leapt in without a moment's hesitation. The moment the goat's four hooves hit the bottom, the fox stepped lightly onto the goat's back, leapt upward, caught the edge of the well, and hauled himself over the rim with a grunt of relief. He stood at the top and looked down at the goat, who stared up at him in dawning, horrified comprehension. ""My apologies,"" the fox said pleasantly, already walking away. ""One should always think about how one intends to get out before one jumps in.""","In any situation, always consider your exit before you commit to your entrance.",sadness,betrayal
21,Snake and the Frog,"A village pond had fallen under a shadow of terror since a large snake had taken up residence in its rushes, picking off frogs at his leisure with lazy, unhurried certainty. The surviving frogs lived in a state of perpetual, exhausting fear. It was the boldest and most cunning frog in the colony who finally raised his head above the waterline and said: ""I have a plan."" He approached the snake directly, which alone nearly caused several of his companions to faint. ""Great serpent,"" the frog said, with an air of great respect, ""I've come on behalf of a remarkable opportunity. There's a colony of fat, slow frogs in the pond to the east — far more than you could eat here in a month. I'll lead you there personally, but we must leave immediately, before they move on."" The snake, his hunger piqued, followed eagerly through unfamiliar territory. The cunning frog led him in long, winding circles until, as evening fell, the snake found himself hopelessly disoriented and far from the pond. By the time the snake made his slow way back over the following days, the frogs had established an entirely new, carefully hidden colony. The pond behind them grew green and still.","A well-constructed strategy, even from a position of weakness, can neutralise the most dangerous opponent.",fear,strategy
22,Bird and the Hunter,"In a forest known for its deep silence and ancient trees, a small lookout bird had taken it upon herself to serve as an early-warning system for the entire community of creatures who lived there. She spent her days perched high in the canopy, watching the forest's edges with calm, systematic attention. One morning she spotted a hunter at the tree line — noting his nets, his careful footfall, his pattern of movement through the undergrowth. Before he'd advanced fifty metres, her sharp alarm call rang out through the forest — a specific pattern of notes that every creature there had learned to recognise and respect. By the time the hunter had set his first net, the forest floor was empty. Birds had risen silently into higher trees. Deer had melted into dense thicket. Even the slow tortoise had found a mossy hollow to press himself into. The hunter walked through the forest for hours, baffled by the absolute absence of anything he might catch, and left before evening without a single prize. The lookout bird watched him go and ruffled her feathers calmly. Around her, the forest gradually filled again with ordinary sounds — and she took her place once more at the top of her favourite tree, watching.",Consistent vigilance and clear communication within a community are the foundations of collective safety.,fear,survival
23,River and the Animals,"A drought of unusual severity had reduced the great river to a thin, muddy trickle by midsummer, and the animals who depended on it were growing desperate. As the waterline fell lower each day, old territorial instincts resurfaced: the elephants claimed the deepest pools, the deer were driven from the shallows by the buffalo, and the smaller animals found themselves with nothing at all. Snarling and shoving replaced the comfortable routine that had always governed their gathering at the water's edge. An old tortoise who had weathered many such droughts pulled himself onto a flat rock at the centre of what remained of the river and waited with unhurried patience until the noise around him subsided enough for his quiet voice to carry. ""We will all die here,"" he said simply, with no particular drama, ""at this rate — not from thirst, but from each other. The river does not have enough water for fighting. But it has enough for sharing, if we choose to do so."" There was a long, uncomfortable silence. Then, gradually, the elephants stepped back. The deer approached. The smaller animals crept to the edges. They drank in rotation, without ceremony, without incident — and the river, that day, was just enough.","In times of scarcity, cooperation is not charity — it is the only strategy that keeps everyone alive.",calm,cooperation
24,King and the Wise Minister,"When an alliance of neighbouring kingdoms began closing in on the kingdom from three sides simultaneously, the royal court erupted into noise — generals arguing for immediate military response, advisors urging desperate diplomacy, merchants calculating losses, and the king himself sitting at the centre of it all with a quietly mounting sense of overwhelm. It was his oldest minister — a man whose robes were frayed at the edges and whose eyes had seen four kings come and go — who waited until the room had exhausted itself and then spoke in a measured, unhurried voice. He had spent the previous night corresponding by fast messenger with contacts in each of the rival courts. Two of the three alliances, he explained, were held together solely by promised trade advantages. Redirect those advantages — offer something more favourable — and the alliances would fracture without a single sword being drawn. The king followed the minister's counsel precisely. Within a fortnight, two of the three kingdoms had quietly withdrawn. The third, isolated and suddenly uncertain, sent a diplomatic envoy instead of an army. The court marvelled. The minister returned to his frayed robes and his correspondence, and asked for nothing except the continued freedom to keep watch.",Patient wisdom and careful intelligence will always outperform force in the resolution of complex challenges.,relief,leadership
25,The Monkey King,"By sheer size and volume, a large and self-important monkey had managed to establish himself as king of his troop — though he possessed none of the qualities that genuine leadership requires. His decisions were made impulsively, based primarily on his own appetite and convenience. He sent the younger monkeys to the most dangerous branches for fruit; he claimed the safest sleeping spots for himself; he settled disputes according to whom he liked more, rather than any principle of fairness. Gradually, the older and wiser members of the troop began to slip away — finding other groups, drifting to distant trees, removing themselves quietly from the chaos. The remaining members grew anxious and thin, making poor decisions because no coherent structure remained to guide them. Eventually, a younger but far more thoughtful monkey — one who listened carefully, shared resources generously, and made decisions with the whole troop in mind — stepped forward without ceremony and began, simply, to lead by example. The self-declared king found, one day, that he was issuing commands to an audience of one. Authority built on nothing but self-interest, he discovered, has a very short shelf life.","Genuine leadership is demonstrated through service and wisdom, not claimed through noise and self-interest.",sadness,leadership
26,Lion and the Hyena,"In a forest where the lion ruled with considered fairness, a cunning hyena had built himself a comfortable position by being useful — carrying messages, running small errands, appearing at all the right moments with flattering words. Then he began testing the edges of his influence. He told the deer that the lion had marked them for culling. He whispered to the elephants that the lion had spoken dismissively of their intelligence. He circulated stories so seamlessly that the forest began to hum with a low, uncomfortable tension that hadn't been there before. It was a small forest mouse — who moved through the undergrowth entirely unnoticed — who first began to notice the pattern: every piece of discord traced, eventually, back to a particular set of paw prints. She brought what she'd observed to the lion in careful, precise terms, with no embellishment and no accusation — only sequence and pattern. The lion summoned those who'd been told things and invited them to speak freely. Within an afternoon, the stories contradicted each other completely, and the common thread was impossible to ignore. The hyena was called to account, and the forest, though bruised, began the slow work of repairing what dishonesty had damaged.","Truth, however carefully buried, leaves tracks; and those who deal in falsehood are always, eventually, found out.",anger,justice
27,Crow and the Snake,"For three consecutive breeding seasons, a snake living in the roots of an ancient banyan tree had made his way up to the crow's nest each time the parents left to forage, and swallowed the eggs without remorse. The crows had tried everything within their power — diving at him, calling for help, attempting to move their nest. Nothing had worked. The snake was simply too large, too fast, and too indifferent to their grief. The male crow, sitting quietly in the aftermath of yet another loss, thought for a very long time. Then he flew to the king's palace and watched the royal household until he understood its patterns. On the afternoon when the queen's ladies-in-waiting left their jewellery on the garden wall while they bathed in the pool, the crow swept down, seized the most conspicuous necklace, and flew in a long, slow, deliberate arc — low enough to be followed — directly back to the banyan tree, dropping the necklace squarely into the snake's hole. The palace guards arrived within minutes. The crow and his mate watched from a high branch as the snake was dealt with efficiently and completely. The next season, they built their nest in peace.","When direct confrontation is futile, an indirect and carefully executed strategy can succeed where raw effort cannot.",anger,revenge
28,Goat and the Tiger,"A young goat, separated from her flock in the confusion of an unexpected storm, found herself alone on an open hillside as night fell — and found herself facing a tiger who had been watching her from the grass for some time with the relaxed patience of an apex predator who has nowhere to be. The tiger rose slowly to his feet and took a step forward. The goat's whole body wanted to run. Instead, she threw her head back and let out a sound she hadn't known she possessed — not the bleat of a frightened goat, but something closer to a battle cry, guttural and bizarre and furious. She lowered her horns and took three rapid steps toward the tiger. The tiger halted. This was entirely unexpected behaviour for prey, and unexpected behaviour was, by instinct, alarming. He took a step back, reassessing. The goat stamped her foot and charged again, still making the terrible sound. The tiger — genuinely uncertain now whether he was dealing with a creature he fully understood — turned and moved off through the grass at a pace that was, for a tiger, rather undignified. The goat stood on the hillside until her legs stopped shaking, and then she went and found her flock.","Unexpected courage, even when built partly on bluff, can destabilize a more powerful opponent's certainty.",relief,courage
29,Fisherman and the Fish,"A school of fish that had lived freely in a wide river for generations came to realise one autumn that the same fisherman appeared at the same bend in the river each morning — and that each afternoon, he returned to his village with a full net. The fish had been losing members steadily for months; the remaining ones were growing cautious, but caution alone wasn't solving the problem. The eldest fish called a gathering in the deepest part of the pool that evening, and for the first time, the school debated together — not the usual frantic scattering, but a deliberate, collective strategy. They would not flee in all directions; they would move as a single coordinated body, too large and too organised to be effectively netted. When the fisherman cast his net the following morning, the fish moved together in a precise, rolling formation — not away from the net, but beneath it, around it, and through it in sections that were too dense to capture cleanly. The net came up twisted and almost empty. The fisherman sat back in his boat with a puzzled expression. The fish held their formation until he had gone, and then they parted — and for the first time in months, they moved through the river without fear.",Collective intelligence and coordinated action can overcome threats that scatter and isolate individuals.,joy,teamwork
30,Dog and the Tiger,"A tiger, emboldened by three consecutive nights without a successful hunt, had begun circling the edges of a farming village at dusk — close enough that the animals in the pens could smell him, and the villagers had taken to barring their doors before sunset. The village dog, a sturdy and not particularly large animal who nonetheless possessed a ferocious sense of territorial responsibility, detected the tiger's scent on the third evening and positioned himself at the village boundary. When the tiger finally emerged from the tree line and met the dog's gaze across twenty metres of open ground, the dog didn't retreat. He stood absolutely still for a moment — then exploded into the most sustained, aggressive, full-throated barking any tiger had ever encountered at such close range. Lights began appearing in windows. Voices carried through the evening air. The tiger, who had expected either prey or silence, found himself facing a creature who had deliberately called attention to both of them — and who showed no signs of stopping. A tiger's greatest advantage is surprise, and surprise was now entirely gone. After a long moment of indecision, the tiger withdrew back into the trees. The dog continued barking until he was certain it had gone, then returned to his post by the gate.","Courage combined with the wisdom to use available resources — noise, community, attention — is more effective than strength alone.",confidence,bravery
31,Elephant and Fox,"A fox who'd grown accustomed to surviving on wit rather than strength spotted a large elephant grazing alone near the marshes one afternoon and immediately began calculating. He approached with exaggerated reverence, bowing low. ""Your Majesty,"" he said smoothly, ""I've discovered a meadow of extraordinary grass — lush, untouched, fragrant. I'd be honoured to escort you there personally."" The elephant, flattered and genuinely hungry, followed without suspicion. The fox led him deeper into the marsh, where the ground grew soft and treacherous beneath the elephant's enormous weight. The elephant's feet sank with each step, and panic began to rise in his chest. But before the fox could slip away satisfied, the elephant's powerful trunk swung out instinctively, wrapped around a sturdy tree, and pulled with everything he had. He hauled himself free with a tremendous effort, mud streaming from his legs. The fox, caught flat-footed by the escape, found himself facing an elephant who was now both free and furious. He fled without ceremony. The elephant stood at the marsh's edge for a long moment, breathing hard, filing the fox's face permanently into his memory. Elephants, as the fox would eventually learn, have a remarkable capacity for recollection.","Deception may create temporary advantage, but the consequences of being caught are rarely worth the gamble.",fear,caution
32,King and the Fool,"In the royal court, a jester had long enjoyed the unusual freedom that came with his role — permitted to say almost anything, shielded by the assumption that nothing he said was to be taken seriously. He exploited this licence gradually, slipping outright falsehoods into his performances, testing how much the court would accept if delivered with enough comic timing. He told elaborate stories about ministers stealing from the treasury, about generals losing battles they'd actually won, about merchants bribing palace officials. People laughed uncertainly, unsure where performance ended and accusation began. The king, who had been watching the pattern develop over several weeks, summoned the jester privately one morning — no audience, no laughter, no costume required. ""Every word spoken in this court carries weight,"" the king said quietly, ""regardless of the clothing it wears."" He tasked his investigators with examining each of the jester's 'jokes' systematically. Several turned out to be pure fabrication; one contained a grain of truth that warranted genuine inquiry. The jester was stripped of his performing privileges and assigned to the royal library — where, the king noted dryly, the only stories permitted were ones that had actually happened.",No role or title grants immunity from accountability; words carry consequences independent of the tone in which they're delivered.,anger,justice
33,Bird Family,"Three generations of a bird family had nested in the same corner of the same forest, and their collective knowledge of that territory — its dangers, its seasonal patterns, its reliable food sources — had been passed down through careful observation and deliberate instruction. When a particularly harsh season arrived, bringing unfamiliar predators and unpredictable weather, the younger birds were grateful for the mental map they'd inherited. They knew which trees offered safe shelter in storms, which clearing to avoid when certain hawks were circling, and which time of morning the forest floor was safest for foraging. When danger approached one afternoon in the form of a prowling cat, the eldest bird's alarm call used a specific pattern the whole family had rehearsed — and every member responded without hesitation, rising together in a coordinated burst that left the cat with nothing to pursue. They regrouped in their designated tree without a single casualty. That evening, the family sat close together in the fading warmth, and the youngest asked the eldest how she'd stayed so calm. ""I've seen this particular kind of threat before,"" she said simply. ""And I made sure you all had, too — at least in your minds.""",A family or community that shares knowledge and practises coordination is far more resilient than one that relies on individual instinct alone.,joy,unity
34,Monkey and Lion,"A lion who'd recently taken over a new territory was making his authority felt in the most direct way available to him — pursuing anything that moved, regardless of whether he was actually hungry, simply to establish dominance. A quick-witted monkey observed this pattern over several days from the canopy above and began to anticipate the lion's movements. When the lion eventually fixed his gaze on the monkey and charged, the monkey didn't flee horizontally across the ground. He went straight up — branch to branch, with the fluid efficiency of a creature designed for exactly this environment. The lion reached the base of the tree, looked up, and found the monkey comfortably settled twenty metres above him, casually inspecting a piece of fruit. The lion circled, looked for another angle, found none, and eventually sat down in frustration. ""Come down,"" he called up. ""Why?"" the monkey asked pleasantly. The lion had no satisfactory answer. He waited for a while, then moved on. The monkey watched him go from his elevated vantage point, unimpressed. Brute power, he reflected, is highly effective in the right terrain — and completely useless in the wrong one.",Know your terrain and your strengths; fighting on ground that suits you is half the battle already won.,relief,intelligence
35,Snake and Farmer,"A farmer working his fields discovered that a snake had taken up residence in a burrow at the edge of his property. His neighbours urged him to deal with it immediately and decisively. Instead, the farmer left a small bowl of milk near the burrow each morning — a gesture he couldn't entirely explain, even to himself, beyond a general sense that coexistence was preferable to conflict where possible. The snake, for its part, kept entirely to its own territory, and the field mice that had previously devastated the farmer's grain stores began to disappear from the area entirely. The arrangement persisted through two full seasons without incident. Then a travelling merchant offered the farmer a significant sum for the land, contingent on it being entirely cleared. The farmer, tempted, approached the burrow with a spade one morning — and the snake, sensing the changed energy, reared up defensively. The farmer stepped back, looked at the spade in his hands, and then looked at the field behind him, healthy and productive in a way it hadn't been before this particular neighbour arrived. He lowered the spade. He declined the merchant's offer. Some arrangements, he'd concluded, were worth more than their immediate market value.","Peaceful coexistence, even with those we might fear, often yields more sustainable benefits than conflict or displacement.",neutral,responsibility
36,The Proud Peacock,"In a forest clearing renowned for its beauty, a peacock had grown so accustomed to the admiration of others that he'd begun to mistake appreciation for entitlement. Each morning he'd spread his magnificent tail in a slow, ceremonial arc — and he'd come to expect the other animals to stop whatever they were doing and watch. When a practical-minded hen walked past one morning without pausing, the peacock was genuinely affronted. ""Do you not find me extraordinary?"" he called after her. ""Moderately,"" she said without turning around, ""but I've got eggs to tend."" The peacock sulked for three days, which the forest at large failed to notice. It was during a sudden rainstorm that the peacock's spectacular tail — sodden, heavy, and impossible to manage in the mud — became an acute liability. He could barely walk. The plain brown hen, meanwhile, moved efficiently through the downpour, settled her eggs, and sorted out her affairs with brisk competence. The peacock stood in the rain, bedraggled and humbled, his magnificent plumage plastered flat. Beauty, he was beginning to understand, is an asset in fair weather — but it is a poor substitute for capability when conditions turn difficult.",Vanity without substance is an indulgence that fair weather permits and adversity quickly dismantles.,surprise,overconfidence
37,Donkey in Lion's Skin,"A donkey who'd found an old, dried lion's skin abandoned at the forest's edge made a discovery that delighted him thoroughly: when he draped it over himself and walked through the trees, every animal he encountered fled in immediate terror. He spent several exhilarating days roaming freely, eating the best grass, drinking from the clearest pools, commanding space that had never been available to him before. The power was intoxicating. He grew bolder, wandering closer to the village, standing in the open field where previously he'd never have dared linger. It was there that his owner spotted the unusual lion and came closer to investigate, puzzled by something in the creature's gait — that familiar, slightly awkward walk he'd recognise anywhere. As the owner watched, a gust of wind lifted a corner of the skin, and the donkey — startled — let out a full-throated, unmistakable bray that rang across the entire field. Every animal that had fled in terror now turned back with expressions ranging from confusion to indignation. The donkey stood in the open, the skin slipping sideways, and understood with crystalline clarity that borrowed authority is only ever one unguarded moment from complete collapse.","An assumed identity may grant temporary advantage, but one's true nature will assert itself — usually at the worst possible moment.",surprise,identity
