story_id,title,story,moral,emotion,theme
38,Four Friends and the Hunter,"A deer, a crow, a tortoise, and a mouse had established an unlikely but genuine friendship at the edge of a quiet lake, each contributing what their particular abilities allowed — the crow as lookout from above, the mouse with her sharp teeth for cutting and freeing, the tortoise as a steady counsel, and the deer as a scout of the surrounding terrain. When a hunter arrived one morning and ensnared the deer in a strong rope net, the remaining three mobilised without panic. The crow flew reconnaissance immediately, mapping the hunter's position and likely return time. The mouse set to work on the ropes with characteristic speed and precision. The tortoise, slower but dependable, positioned himself to create a distraction if needed. The deer was freed well before the hunter returned, and all four had retreated to safety before he found nothing but the cut ropes lying in the grass. The hunter stood for a moment in baffled silence, then gathered his equipment and moved on. Back at the lake, the four friends settled into their usual places — a little quieter than normal, each privately grateful for the particular capabilities of the others.","A group whose members each contribute distinct strengths functions with a resilience that no individual, however capable, can match alone.",relief,teamwork
39,Clever Rabbit and the Well,"When drought drove a herd of elephants to a lake that happened to be the ancestral home of a large rabbit colony — their burrows ringing the water's edge — the elephants' daily visitations were causing devastation. The rabbit chief was a small, grey, entirely unremarkable-looking creature who nevertheless had a particular talent for reading situations and improvising rapidly. He presented himself before the elephant king at the next full moon, standing in the reflected light with deliberate timing, and announced that he was a personal messenger of the Moon — whose sacred lake the elephants had been desecrating with their presence. The elephant king, educated enough to be respectful of forces beyond his understanding, asked how he might know this to be true. The rabbit led him to the lake's edge and asked him to observe the water. The full moon's reflection shimmered beautifully on the surface. ""She trembles with displeasure even now,"" the rabbit said gravely. The elephant king stepped back, offered a formal apology to the water's surface, and redirected his herd to a different water source the following morning. The rabbit returned to the colony, where he was greeted with the particular mixture of relief and impressed disbelief that tends to follow when a very small creature outmanoeuvres a very large one.",Resourceful thinking and confident presentation can resolve problems that size and strength are powerless to address.,triumph,intelligence
40,Wolves and the Sheep,"A pack of wolves who'd been unsuccessful in their direct approaches to a well-guarded flock of sheep devised a more patient strategy. They sent their most presentable member — young, well-groomed, and possessed of a remarkably unthreatening demeanour — to approach the shepherd with an offer of alliance. ""We'll patrol your perimeter each night,"" he offered pleasantly, ""and keep other predators away. All we ask is the occasional old or sick sheep that would have died regardless."" The shepherd, who'd been losing animals to various threats and was genuinely stretched, agreed after only brief deliberation. The wolf joined the flock's routine, behaved impeccably for several weeks, and used every day to memorise the shepherd's schedule, the dogs' patrol patterns, and the weakest points in the pen's fencing. When the night finally came that the shepherd was away at market and the dogs had been locked in for the night due to an illness in the household, the wolf opened a gap in the fence that he'd been quietly widening for days. By morning, the damage was considerable. The shepherd returned to count his losses and found, among the tracks, the unmistakable paw prints of his trusted ally.",An enemy who gains trust through patience and performance is considerably more dangerous than one who simply attacks.,betrayal,trust
41,The Singing Donkey,"A washerman's donkey who spent his days carrying heavy loads discovered one night, wandering free in an open field, that he possessed an overwhelming urge to sing. He opened his mouth and brayed with full enthusiasm — convinced, in the way that those without musical education often are, that the sound he produced was extraordinary. A jackal resting nearby opened one eye and regarded him with weary resignation. ""Please don't,"" the jackal said. ""It's the middle of the night and the village is fifty metres away."" The donkey, insulted, informed the jackal that he simply didn't appreciate real artistry, and continued with increased vigour. Lights appeared in the village. Dogs began barking. The washerman, roused from sleep and deeply unhappy about it, arrived at the field with a stick and expressed his dissatisfaction in the most direct terms available to him. The donkey, reunited firmly with his tether and now considerably less enthusiastic about his musical gifts, stood in the dark nursing both his dignity and several new bruises. The jackal, who had relocated at the first sound of the village dogs, settled back to sleep at a more comfortable distance and said nothing further on the subject.",Self-awareness is as important as self-expression; the inability to assess one's own limitations is a liability that others invariably pay for.,anger,overconfidence
42,The Hare and the Tortoise,"The hare and the tortoise had been acquainted for years — long enough for the hare to have developed a comfortable certainty about the distance between their respective capabilities. When the tortoise quietly proposed a race to the old oak at the forest's far edge, the hare accepted with barely concealed amusement. He set off at a pace that left the tortoise invisible within minutes, then slowed to a confident trot, then stopped entirely near a shady bank to rest. He told himself he'd hear the tortoise coming and would easily finish before him. He was still telling himself this when a ripple of surprised murmuring reached him from the direction of the oak tree. He arrived at the finish to find the tortoise already there — composed, unhurried, entirely unsurprised by the outcome. The hare stood in the sun and processed what had happened. The tortoise hadn't beaten him with speed. He hadn't beaten him with any exceptional ability at all. He'd simply kept moving, consistently, without interruption, for the entire duration — while the hare had outsmarted himself with assumptions built on nothing more substantial than a very long habit of being faster.","Consistent, uninterrupted effort will outperform superior talent that's been squandered on complacency.",surprise,overconfidence
43,The Jackal and the Drum,"A hungry jackal prowling the outskirts of an abandoned battlefield came across a large drum that had been left propped against a tree, its ropes still attached to a low branch. When the wind picked up and set the branch swaying, the ropes tapped rhythmically against the drum's taut skin — producing a sound that stopped the jackal cold. He spent a considerable amount of time at a careful distance, interpreting the sound, constructing elaborate theories about what enormous creature might produce such a resonance. His imagination, running freely, generated several possibilities, each more alarming than the last. He was on the verge of retreating entirely when a stronger gust swung the branch more violently, the ropes slapped hard, and the drum rolled sideways and fell open — revealing its complete and uncomplicated emptiness. The jackal walked over, sniffed it thoroughly, and sat beside it for a moment in the sudden quiet. The largest sounds, he reflected, do not always indicate the largest sources. In fact, in his experience, the opposite was frequently true — the most hollow things tended to make the most impressive noise.",Intimidating appearances and loud presentations are frequently hollow at their centre; investigation reveals what imagination distorts.,surprise,curiosity
44,The Brahmin and the Cobra,"A learned brahmin who'd settled near the forest's edge made a daily practice of leaving offerings at a particular anthill — partly from piety, partly from a genuine belief in the virtue of consistent ritual. A cobra who lived within the anthill accepted these offerings with the dignified indifference of a creature entirely comfortable with being venerated. The arrangement continued peacefully for several years. The brahmin's son, visiting from the city and possessed of neither his father's patience nor his reverence, decided the offerings were a waste of food and that the cobra was simply an animal taking advantage. He arrived at the anthill one morning with a stick and struck at it sharply. The cobra, defending its home with the focused decisiveness of a creature that had never needed to learn tolerance of sudden violence, responded accordingly. The son survived, but only just. When the brahmin returned and heard what had occurred, he sat quietly outside the anthill for a long time before speaking. ""We had an understanding,"" he said finally — addressing the anthill with the same respectful tone he'd always used. ""I hope, in time, it can be restored."" It took three seasons. But it was.",Relationships built on mutual respect are disrupted at great cost; what takes years to establish can be destroyed in a single impatient moment.,fear,trust
45,The Three Fish,"Three fish lived together in a pond that a pair of fishermen, passing by one evening, marked for a return visit the following morning. One fish overheard them clearly and immediately convened a discussion. The first fish — practical, experienced, and unsentimental — announced that she would leave the pond that night through the narrow inlet stream, while the water level was still high enough to allow passage. ""The risk is now,"" she said, ""before the certainty arrives."" The second fish agreed in principle but deferred his departure, telling himself he'd go at first light. He slept more comfortably than the first fish and departed at dawn — managing to squeeze through the inlet just as the fishermen appeared on the opposite bank. The third fish spent the morning assuring himself that his intelligence and swimming ability would see him through any net they might cast, and that leaving would be an overreaction to a threat that might not materialise. By midday, he was in a bucket. The pond was a smaller place by evening — but two of its three wisest inhabitants were elsewhere, swimming freely in new water, already making themselves at home.","The willingness to act decisively on credible warning, rather than waiting for certainty, is frequently the difference between safety and catastrophe.",fear,strategy
46,The Crane and the Mongoose,"A crane who nested in a tall tree above a busy pond had developed an arrangement with a mongoose who patrolled the surrounding undergrowth — the mongoose dealt with any snakes that threatened the nest; the crane, in return, warned the mongoose of approaching humans with a specific call. The partnership had functioned effectively for two full breeding seasons. But the crane, whose nest had grown particularly productive that year, began to resent the mongoose's share of the arrangement's benefits — specifically, the advance warning that allowed the mongoose to avoid traps set by villagers. She began delaying her warnings by a few seconds, rationalising that the mongoose was perfectly capable of detecting humans on his own. The mongoose noticed the change but said nothing, and quietly began operating with greater caution independently. When a snake reached the nest one afternoon during the crane's absence — and the mongoose, who'd been nearby, had already moved on — the crane returned to considerable damage. She sat in the ruined nest and considered the sequence of events with uncomfortable clarity. She'd dismantled a functioning alliance incrementally and privately, and the cost had arrived in the same manner: quietly, and all at once.",A partnership diminished gradually through self-interest will fail at the worst possible moment — and the erosion is always felt by the one who began it.,sadness,cooperation
47,The Foolish Sage,"A sage who'd spent forty years accumulating learning had developed, alongside his genuine wisdom, a well-concealed conviction that his knowledge was essentially complete. When a young student arrived at his hermitage asking questions that the sage found unexpectedly difficult to answer — not because they were beyond the student's level, but because they were genuinely complex — the sage defaulted to a pattern he'd never noticed in himself before: he answered with great confidence and considerable eloquence, constructing responses that sounded authoritative and felt satisfying to deliver, but which were, in several important particulars, simply incorrect. The student, who had studied widely before arriving, recognised the errors but was uncertain how to address them without causing offence. He eventually presented the discrepancies gently, framing them as his own confusion. The sage fell silent for what felt like a long time. ""You've studied this more recently than I have,"" he said finally — and the admission, though quiet, required more genuine courage than forty years of solitary scholarship had ever demanded of him. He spent the following week reviewing what he'd taught. He corrected three errors in writing and informed the student directly. It was, the student later reflected, the most useful thing the sage had ever taught him.",The willingness to acknowledge the limits of one's knowledge is the mark of genuine wisdom — and far rarer than the accumulation of learning itself.,neutral,wisdom
48,The Merchant's Parrot,"A wealthy merchant kept a parrot of remarkable intelligence in his shop — one that had absorbed enough of the business's daily conversation to participate in it with convincing fluency. The parrot could quote prices accurately, recall the names of regular customers, and produce phrases of such commercial persuasiveness that several transactions had been completed in the merchant's brief absences that he could not subsequently fully account for. The merchant, amused and somewhat unnerved, decided to test the parrot's limitations by asking him directly: ""What is the value of honesty in business?"" The parrot tilted his head and produced, from his extensive repository, a perfectly composed response about integrity and long-term reputation. ""And do you practise it?"" the merchant asked. The parrot was silent for a moment. ""I produce,"" he said carefully, ""what is asked of me."" The merchant found this answer unexpectedly instructive — not about the parrot, but about his shop, his customers, and the conversations that had shaped this particular creature over the years of his presence. He spent the following week listening to what his business actually sounded like, and made several adjustments whose effects were modest but persistent.",What we repeatedly say and hear shapes what we become; our environment teaches us whether we intend it to or not.,surprise,wisdom
49,The Lost Camel,"A merchant travelling with a caravan across a vast and largely featureless plain noticed one morning that one of his camels — a reliable, good-tempered animal he'd owned for six years — was missing from the line. He retraced the previous day's route as far as he could reasonably manage, asked at the two settlements they'd passed through, and found nothing. At a crossroads some distance from the caravan's path, he encountered a traveller coming from the opposite direction. Before the merchant could describe the camel, the traveller said: ""You're looking for a camel — lame in the left foreleg, missing its right eye, carrying a load that's heavier on one side than the other, with a taste for the sweeter grass that grows on the eastern verge of the road."" The merchant stared. ""You've seen him?"" ""No,"" the traveller said pleasantly. ""I've only seen his tracks."" He described each detail he'd observed and how he'd read it from the ground and the vegetation. The merchant found the camel that afternoon, sheltering in a depression exactly where the traveller's reasoning had led him. He'd spent hours searching in the wrong direction entirely. Observation, he reflected, reads the present; assumption only rewrites the past.","Careful, systematic observation of available evidence will locate the truth more reliably than any amount of anxious searching based on assumption.",relief,strategy
50,The Kingdom of Fools,"A scholar and his student, travelling between cities, arrived at dusk at a kingdom whose peculiarities became apparent within the first hour. The city walls were being built thicker by order of the king — not because thicker walls offered better protection, but because a brick had fallen on a citizen's head during the original construction, and the king had concluded that heavier bricks were the solution to falling bricks. The scholar watched the construction activity with quiet attention, declined to comment publicly, and found lodging for the night. Over dinner, he asked the innkeeper careful questions about the kingdom's governance — how decisions were made, who was consulted, what happened when policies caused harm. The answers were consistent: decisions flowed in one direction only, from the top down, uncontested. The scholar left early the following morning, before the city's working day had begun. His student, frustrated, demanded to know why he hadn't spoken up. ""Because,"" the scholar said, ""a kingdom that has constructed an entire system around avoiding challenge to authority will not be improved by a visiting stranger pointing out the obvious. It will only improve when enough people inside it become uncomfortable enough to say, clearly and to the right people, what they already know."" They walked in silence for a while. ""Are we going back?"" the student asked. ""Not yet,"" the scholar said.","Systemic foolishness cannot be corrected from the outside by pointing; it requires internal awareness, honest communication, and the courage to speak within the system itself.",neutral,leadership
